ARC_CODE,DESCRIPTION,ARC_2DIGIT,CATEGORY_NAME,SUBCATEGORY
2.1111,Control pressure on steamer operations,2.1,Combustion Systems,Furnaces/Ovens - Operations
2.1112,Heat oil to proper temperature for good atomization,2.1,Combustion Systems,Furnaces/Ovens - Operations
2.1113,Reduce combustion air flow to optimum,2.1,Combustion Systems,Furnaces/Ovens - Operations
2.1114,Limit and control secondary combustion air in furnace,2.1,Combustion Systems,Furnaces/Ovens - Operations
2.1115,Eliminate combustible gas in flue gas,2.1,Combustion Systems,Furnaces/Ovens - Operations
2.1116,Improve combustion control capability,2.1,Combustion Systems,Furnaces/Ovens - Operations
2.1117,Relocate oven/furnace to more efficient location,2.1,Combustion Systems,Furnaces/Ovens - Operations
2.1121,Use insulation in furnaces to facilitate heating/cooling,2.1,Combustion Systems,Furnaces/Ovens - Hardware
2.1122,Re-size charging openings or add a movable door on equipment,2.1,Combustion Systems,Furnaces/Ovens - Hardware
2.1123,Install automatic stack damper,2.1,Combustion Systems,Furnaces/Ovens - Hardware
2.1124,Replace direct fired equipment with steam heat,2.1,Combustion Systems,Furnaces/Ovens - Hardware
2.1125,Convert to oxy-fuel burners,2.1,Combustion Systems,Furnaces/Ovens - Hardware
2.1131,"Repair faulty insulation in furnaces, boilers, etc.",2.1,Combustion Systems,Furnaces/Ovens - Maintenance
2.1132,Repair faulty louvers and dampers,2.1,Combustion Systems,Furnaces/Ovens - Maintenance
2.1133,Adjust burners for efficient operation,2.1,Combustion Systems,Furnaces/Ovens - Maintenance
2.1134,Eliminate leaks in combustible gas lines,2.1,Combustion Systems,Furnaces/Ovens - Maintenance
2.1135,Repair furnaces and oven doors so that they seal efficiently,2.1,Combustion Systems,Furnaces/Ovens - Maintenance
2.1211,Move boiler to more efficient location,2.1,Combustion Systems,Boilers - Operation
2.1212,Operate boilers on high fire setting,2.1,Combustion Systems,Boilers - Operation
2.1213,Direct warmest air to combustion intake,2.1,Combustion Systems,Boilers - Operation
2.1221,Replace obsolete burners with more efficient ones,2.1,Combustion Systems,Boilers - Hardware
2.1222,Install turbulators,2.1,Combustion Systems,Boilers - Hardware
2.1223,Install smaller boiler (increase high fire duty cycle),2.1,Combustion Systems,Boilers - Hardware
2.1224,Replace boiler,2.1,Combustion Systems,Boilers - Hardware
2.1231,Establish burner maintenance schedule for boilers,2.1,Combustion Systems,Boilers - Maintenance
2.1232,Keep boiler tubes clean,2.1,Combustion Systems,Boilers - Maintenance
2.1233,Analyze flue gas for proper air/fuel ratio,2.1,Combustion Systems,Boilers - Maintenance
2.1241,Reduce excessive boiler blowdown,2.1,Combustion Systems,Boilers - Blowdown
2.1242,Minimize boiler blowdown with better feedwater treatment,2.1,Combustion Systems,Boilers - Blowdown
2.1243,Use heat from boiler blowdown to preheat boiler feed water,2.1,Combustion Systems,Boilers - Blowdown
2.1311,Replace electrically-operated equipment with fossil fuel equipment,2.1,Combustion Systems,Fuel Switching - Electric to Fossil
2.1321,Replace fossil fuel equipment with electrical equipment,2.1,Combustion Systems,Fuel Switching - Fossil to Electric
2.1331,Burn a less expensive grade of fuel,2.1,Combustion Systems,Fuel Switching - Alternate Fuel
2.1332,Convert combustion equipment to burn natural gas,2.1,Combustion Systems,Fuel Switching - Alternate Fuel
2.1333,Convert combustion equipment to burn oil,2.1,Combustion Systems,Fuel Switching - Alternate Fuel
2.1335,"Replace gasoline with diesel, LPG, or natural gas",2.1,Combustion Systems,Fuel Switching - Alternate Fuel
2.1336,Install equipment to utilize waste fuel,2.1,Combustion Systems,Fuel Switching - Alternate Fuel
2.1391,Replace purchased steam with electric heating,2.1,Combustion Systems,Fuel Switching - Misc
2.1392,Replace purchased steam with other energy source,2.1,Combustion Systems,Fuel Switching - Misc
2.1393,Use steam sparging or injections in place of indirect heating,2.1,Combustion Systems,Fuel Switching - Misc
2.1394,Replace steam jets on vacuum system with electric motor driven vacuum pumps,2.1,Combustion Systems,Fuel Switching - Misc
2.2111,Install steam trap,2.2,Thermal Systems,Steam - Traps
2.2112,Use correct size steam traps,2.2,Thermal Systems,Steam - Traps
2.2113,Repair or replace steam traps,2.2,Thermal Systems,Steam - Traps
2.2114,Shut off steam traps on superheated steam lines when not in use,2.2,Thermal Systems,Steam - Traps
2.2121,Increase amount of condensate returned,2.2,Thermal Systems,Steam - Condensate
2.2122,Install/repair insulation on condensate lines,2.2,Thermal Systems,Steam - Condensate
2.2123,Insulate feedwater tank,2.2,Thermal Systems,Steam - Condensate
2.2124,Install deaerator in place of condensate tank,2.2,Thermal Systems,Steam - Condensate
2.2126,Lower operating pressure of condenser (steam),2.2,Thermal Systems,Steam - Condensate
2.2127,Flash condensate to produce lower pressure steam,2.2,Thermal Systems,Steam - Condensate
2.2128,Use steam condensate for hot water supply (non-potable),2.2,Thermal Systems,Steam - Condensate
2.2134,Eliminate leaks in high pressure reducing stations,2.2,Thermal Systems,Steam - Leaks/Insulation
2.2135,Repair and eliminate steam leaks,2.2,Thermal Systems,Steam - Leaks/Insulation
2.2136,Install/repair insulation on steam lines,2.2,Thermal Systems,Steam - Leaks/Insulation
2.2141,Operate distillation columns efficiently,2.2,Thermal Systems,Steam - Distillation
2.2151,Clean steam coils in processing tanks,2.2,Thermal Systems,Steam - Maintenance
2.2152,Maintain steam jets used for vacuum system,2.2,Thermal Systems,Steam - Maintenance
2.2153,Close off unneeded steam lines,2.2,Thermal Systems,Steam - Maintenance
2.2161,Optimize operation of multi-stage vacuum steam jets,2.2,Thermal Systems,Steam - Operations
2.2162,Reduce excess steam bleeding,2.2,Thermal Systems,Steam - Operations
2.2163,Use minimum steam operating pressure,2.2,Thermal Systems,Steam - Operations
2.2164,Turn off steam tracing during mild weather,2.2,Thermal Systems,Steam - Operations
2.2165,Substitute air for steam to atomize oil,2.2,Thermal Systems,Steam - Operations
2.2191,Substitute hot process fluids for steam,2.2,Thermal Systems,Steam - Misc
2.2192,Use heat exchange fluids instead of steam in pipeline tracing systems,2.2,Thermal Systems,Steam - Misc
2.2211,Use optimum temperature,2.2,Thermal Systems,Heating - Operation
2.2212,Use minimum safe oven ventilation,2.2,Thermal Systems,Heating - Operation
2.2221,"Use immersion heating in tanks, melting pots, etc.",2.2,Thermal Systems,Heating - Hardware
2.2222,Convert liquid heaters from underfiring to immersion or submersion heating,2.2,Thermal Systems,Heating - Hardware
2.2223,Enhance sensitivity of temperature control and cutoff,2.2,Thermal Systems,Heating - Hardware
2.2311,Heat treat parts only to required specifications or standards,2.2,Thermal Systems,Heat Treating
2.2312,Minimize non-essential material in heat treatment process,2.2,Thermal Systems,Heat Treating
2.2313,Use batch firing with kiln furniture specifically designed,2.2,Thermal Systems,Heat Treating
2.2314,Replace heat treating oven with more efficient unit,2.2,Thermal Systems,Heat Treating
2.2414,Use waste heat from hot flue gases to preheat,2.2,Thermal Systems,Heat Recovery - Flue Gas Recuperation
2.2421,Install waste heat boiler to provide direct power,2.2,Thermal Systems,Heat Recovery - Flue Gas Other
2.2422,Use waste heat from hot flue gases to generate steam,2.2,Thermal Systems,Heat Recovery - Flue Gas Other
2.2423,Install waste heat boiler to produce steam,2.2,Thermal Systems,Heat Recovery - Flue Gas Other
2.2424,Use heat in flue gases to preheat products or materials,2.2,Thermal Systems,Heat Recovery - Flue Gas Other
2.2425,Use flue gases to heat process or service water,2.2,Thermal Systems,Heat Recovery - Flue Gas Other
2.2426,Use waste heat from flue gases to heat space conditioning air,2.2,Thermal Systems,Heat Recovery - Flue Gas Other
2.2427,Use waste heat from hot flue gases to preheat incoming fluids,2.2,Thermal Systems,Heat Recovery - Flue Gas Other
2.2428,"Use flue gases in radiant heater for space heating, ovens, etc.",2.2,Thermal Systems,Heat Recovery - Flue Gas Other
2.2437,Recover waste heat from equipment,2.2,Thermal Systems,Heat Recovery - Specific Equipment
2.2441,Preheat boiler makeup water with waste process heat,2.2,Thermal Systems,Heat Recovery - Process Waste Heat
2.2442,Preheat combustion air with waste heat,2.2,Thermal Systems,Heat Recovery - Process Waste Heat
2.2443,Re-use or recycle hot or cold process exhaust air,2.2,Thermal Systems,Heat Recovery - Process Waste Heat
2.2444,Use hot process fluids to preheat incoming process fluids,2.2,Thermal Systems,Heat Recovery - Process Waste Heat
2.2447,Heat water with exhaust heat,2.2,Thermal Systems,Heat Recovery - Process Waste Heat
2.2449,"Recover heat from exhausted steam, hot air or hot water",2.2,Thermal Systems,Heat Recovery - Process Waste Heat
2.2491,Use cooling air which cools hot work pieces for space heating,2.2,Thermal Systems,Heat Recovery - Misc
2.2492,Use heat wheel or other heat exchanger to cross-exchange building exhaust air with make-up air,2.2,Thermal Systems,Heat Recovery - Misc
2.2511,Insulate bare equipment,2.2,Thermal Systems,Heat Containment - Insulation
2.2514,Cover open tanks,2.2,Thermal Systems,Heat Containment - Insulation
2.2515,Use optimum thickness insulation,2.2,Thermal Systems,Heat Containment - Insulation
2.2521,Isolate steam lines to avoid heating air conditioned areas,2.2,Thermal Systems,Heat Containment - Isolation
2.2522,Isolate hot or cold equipment,2.2,Thermal Systems,Heat Containment - Isolation
2.2523,Reduce infiltration; isolate hot equipment from refrigerated areas,2.2,Thermal Systems,Heat Containment - Isolation
2.2524,Avoid cooling of process streams or materials that must subsequently be heated,2.2,Thermal Systems,Heat Containment - Isolation
2.2525,Eliminate cooling of process streams which subsequently must be heated and vice versa,2.2,Thermal Systems,Heat Containment - Isolation
2.2531,Re-size charging openings or add movable cover or door,2.2,Thermal Systems,Heat Containment - Infiltration
2.2532,Use only amount of air necessary to prevent explosion hazard,2.2,Thermal Systems,Heat Containment - Infiltration
2.2533,Replace air curtain doors with solid doors,2.2,Thermal Systems,Heat Containment - Infiltration
2.2611,Moderate cooling tower outlet temperature,2.2,Thermal Systems,Cooling - Cooling Towers
2.2612,Use cooling tower water instead of refrigeration,2.2,Thermal Systems,Cooling - Cooling Towers
2.2613,Use antifreeze in cooling towers to allow winter use,2.2,Thermal Systems,Cooling - Cooling Towers
2.2614,Use cooling tower or economizer to replace chiller cooling,2.2,Thermal Systems,Cooling - Cooling Towers
2.2615,Clean condenser tubes,2.2,Thermal Systems,Cooling - Cooling Towers
2.2621,Modify refrigeration system to operate at a lower pressure,2.2,Thermal Systems,Cooling - Chillers/Refrigeration
2.2622,Replace existing chiller with high efficiency model,2.2,Thermal Systems,Cooling - Chillers/Refrigeration
2.2623,Minimize condenser cooling water temperature,2.2,Thermal Systems,Cooling - Chillers/Refrigeration
2.2624,Use cold waste water to cool chiller feed water,2.2,Thermal Systems,Cooling - Chillers/Refrigeration
2.2625,Chill water to the highest temperature possible,2.2,Thermal Systems,Cooling - Chillers/Refrigeration
2.2626,Avoid frost formation on evaporators,2.2,Thermal Systems,Cooling - Chillers/Refrigeration
2.2627,Use multiple-effect evaporators,2.2,Thermal Systems,Cooling - Chillers/Refrigeration
2.2628,Utilize a less expensive cooling method,2.2,Thermal Systems,Cooling - Chillers/Refrigeration
2.2691,Shut off cooling if cold outside air will cool process,2.2,Thermal Systems,Cooling - Misc
2.2692,Use outside cold water source as a supply of cooling water,2.2,Thermal Systems,Cooling - Misc
2.2693,Use waste heat steam for absorption refrigeration,2.2,Thermal Systems,Cooling - Misc
2.2694,Use highest temperature for chilling or cold storage,2.2,Thermal Systems,Cooling - Misc
2.2695,Use cascade system of recirculating during cold weather to avoid sub-cooling,2.2,Thermal Systems,Cooling - Misc
2.2696,Use excess cold process fluid for industrial cooling needs,2.2,Thermal Systems,Cooling - Misc
2.2711,Utilize outside air instead of conditioned air for drying,2.2,Thermal Systems,Drying
2.3111,Heat water during off-peak periods and store for later use,2.3,Electrical Power,Demand Mgmt - Thermal Storage
2.3112,Store heated/cooled water for use during peak demand periods,2.3,Electrical Power,Demand Mgmt - Thermal Storage
2.3113,Make ice during off peak hours for cooling,2.3,Electrical Power,Demand Mgmt - Thermal Storage
2.3131,Reschedule plant operations or reduce load to avoid peaks,2.3,Electrical Power,Demand Mgmt - Scheduling
2.3132,Recharge batteries during off-peak demand periods,2.3,Electrical Power,Demand Mgmt - Scheduling
2.3133,Consider three or four days around-the-clock operation rather than one or two shifts per day,2.3,Electrical Power,Demand Mgmt - Scheduling
2.3134,Shift from daytime to nighttime operation,2.3,Electrical Power,Demand Mgmt - Scheduling
2.3135,Schedule routine maintenance during non-operating periods,2.3,Electrical Power,Demand Mgmt - Scheduling
2.3136,Overlap custodial services with normal day hours,2.3,Electrical Power,Demand Mgmt - Scheduling
2.3137,Use power during off-peak periods,2.3,Electrical Power,Demand Mgmt - Scheduling
2.3141,Use batteries for demand control,2.3,Electrical Power,Demand Mgmt - Battery Storage
2.3142,Use batteries for power quality issues,2.3,Electrical Power,Demand Mgmt - Battery Storage
2.3191,Use demand controller or load shedder,2.3,Electrical Power,Demand Mgmt - Misc
2.3192,Use fossil fuel powered generator during peak demand periods,2.3,Electrical Power,Demand Mgmt - Misc
2.3212,Optimize plant power factor,2.3,Electrical Power,Power Factor
2.3311,Replace DC equipment with AC equipment,2.3,Electrical Power,Generation - DC
2.3312,Install efficient rectifiers,2.3,Electrical Power,Generation - DC
2.3321,Use steam pressure reduction to generate power,2.3,Electrical Power,Generation - AC
2.3322,Use existing dam to generate electricity,2.3,Electrical Power,Generation - AC
2.3323,Install emissions controls to increase capacity,2.3,Electrical Power,Generation - AC
2.3411,Replace electric motors with back pressure steam turbines and use exhaust steam for process heat,2.3,Electrical Power,Cogeneration
2.3412,Use waste heat to produce steam to drive a steam turbine generator,2.3,Electrical Power,Cogeneration
2.3413,Burn fossil fuel to produce steam to drive a steam turbine generator and use steam exhaust for heat,2.3,Electrical Power,Cogeneration
2.3414,Burn waste to produce steam to drive a steam turbine generator set and use steam exhaust for heat,2.3,Electrical Power,Cogeneration
2.3415,Use a fossil fuel engine to cogenerate electricity or motive power; and utilize heat,2.3,Electrical Power,Cogeneration
2.3416,Use combined cycle gas turbine generator sets with waste heat boilers connected to turbine exhaust,2.3,Electrical Power,Cogeneration
2.3417,Use waste heat with a closed-cycle gas turbine-generator set to cogenerate electricity and heat,2.3,Electrical Power,Cogeneration
2.3511,Use plant owned transformers or lease transformers,2.3,Electrical Power,Transmission - Transformers
2.3512,De-energize excess transformer capacity,2.3,Electrical Power,Transmission - Transformers
2.3513,Consider power loss as well as initial loads and load growth in down-sizing transformers,2.3,Electrical Power,Transmission - Transformers
2.3521,Reduce load on electrical conductor to reduce heating losses,2.3,Electrical Power,Transmission - Conductor Size
2.3522,Increase electrical conductor size to reduce distribution losses,2.3,Electrical Power,Transmission - Conductor Size
2.4111,Utilize energy-efficient belts and other improved mechanisms,2.4,Motor Systems,Motors - Operation
2.4112,Install soft-start to eliminate nuisance trips,2.4,Motor Systems,Motors - Operation
2.4113,Install motor voltage controller on lightly loaded motors,2.4,Motor Systems,Motors - Operation
2.4132,Size electric motors for peak operating efficiency,2.4,Motor Systems,Motors - Hardware
2.4133,Use most efficient type of electric motors,2.4,Motor Systems,Motors - Hardware
2.4134,Replace electric motor with fossil fuel engine,2.4,Motor Systems,Motors - Hardware
2.4145,Install isolation transformer on adjustable frequency drive,2.4,Motor Systems,Motors - Drives
2.4146,Use adjustable frequency drive or multiple speed motors on existing system,2.4,Motor Systems,Motors - Drives
2.4151,Develop a repair/replace policy,2.4,Motor Systems,Motors - Maintenance
2.4152,Use only certified motor repair shops,2.4,Motor Systems,Motors - Maintenance
2.4153,Avoid emergency rewind of motors,2.4,Motor Systems,Motors - Maintenance
2.4154,Avoid rewinding motors more than twice,2.4,Motor Systems,Motors - Maintenance
2.4155,Standardize motor inventory,2.4,Motor Systems,Motors - Maintenance
2.4156,Establish a preventative maintenance program,2.4,Motor Systems,Motors - Maintenance
2.4157,Establish a predictive maintenance program,2.4,Motor Systems,Motors - Maintenance
2.4221,Install compressor air intakes in coolest locations,2.4,Motor Systems,Air Compressors - Hardware
2.4222,Install adequate dryers on air lines to eliminate blowdown,2.4,Motor Systems,Air Compressors - Hardware
2.4223,Install direct acting units in place of compressed air pressure system,2.4,Motor Systems,Air Compressors - Hardware
2.4224,Upgrade controls on compressors,2.4,Motor Systems,Air Compressors - Hardware
2.4225,Install common header on compressors,2.4,Motor Systems,Air Compressors - Hardware
2.4226,Use/purchase optimum sized compressor,2.4,Motor Systems,Air Compressors - Hardware
2.4227,Use compressor air filters,2.4,Motor Systems,Air Compressors - Hardware
2.4231,Reduce the pressure of compressed air to the minimum required,2.4,Motor Systems,Air Compressors - Operations
2.4234,Cool compressor air intake with heat exchanger,2.4,Motor Systems,Air Compressors - Operations
2.4235,Remove or close off unneeded compressed air lines,2.4,Motor Systems,Air Compressors - Operations
2.4236,Eliminate leaks in inert gas and compressed air lines/valves,2.4,Motor Systems,Air Compressors - Operations
2.4237,Substitute compressed air cooling with water or air cooling,2.4,Motor Systems,Air Compressors - Operations
2.4238,Do not use compressed air for personal cooling,2.4,Motor Systems,Air Compressors - Operations
2.4239,Eliminate or reduce compressed air usage,2.4,Motor Systems,Air Compressors - Operations
2.4311,Recover mechanical energy,2.4,Motor Systems,Other Equipment - Operations
2.4312,Improve lubrication practices,2.4,Motor Systems,Other Equipment - Operations
2.4313,Provide proper maintenance of motor driven equipment,2.4,Motor Systems,Other Equipment - Operations
2.4314,Use synthetic lubricant,2.4,Motor Systems,Other Equipment - Operations
2.4321,Upgrade obsolete equipment,2.4,Motor Systems,Other Equipment - Hardware
2.4322,Use or replace with energy efficient substitutes,2.4,Motor Systems,Other Equipment - Hardware
2.4323,Use optimum size and capacity equipment,2.4,Motor Systems,Other Equipment - Hardware
2.4324,Replace hydraulic/pneumatic equipment with electric equipment,2.4,Motor Systems,Other Equipment - Hardware
2.4325,Upgrade conveyors,2.4,Motor Systems,Other Equipment - Hardware
2.5111,Convert from indirect to direct fired systems,2.5,Industrial Design,Systems - Thermal
2.5112,Use continuous equipment which retains process heating conveyors within the heated chamber,2.5,Industrial Design,Systems - Thermal
2.5113,Use direct flame impingement or infrared processing for chamber type heating,2.5,Industrial Design,Systems - Thermal
2.5114,Use shaft type furnaces for preheating incoming material,2.5,Industrial Design,Systems - Thermal
2.5115,Reposition oven walls to reduce heated space,2.5,Industrial Design,Systems - Thermal
2.5117,Convert to indirect temperature control system,2.5,Industrial Design,Systems - Thermal
2.5121,Redesign flow to minimize mass transfer length,2.5,Industrial Design,Systems - Mechanical
2.5122,"Replace high resistance ducts, pipes, and fittings",2.5,Industrial Design,Systems - Mechanical
2.5123,Reduce fluid flow rates,2.5,Industrial Design,Systems - Mechanical
2.5124,Use gravity feeds wherever possible,2.5,Industrial Design,Systems - Mechanical
2.5125,Size air handling grills/ducts coils to minimize air resistance,2.5,Industrial Design,Systems - Mechanical
2.5191,Modify dye beck,2.5,Industrial Design,Systems - Misc
2.5192,Modify textile dryers,2.5,Industrial Design,Systems - Misc
2.5193,Convert from batch to continuous operation,2.5,Industrial Design,Systems - Misc
2.5194,Redesign process,2.5,Industrial Design,Systems - Misc
2.5195,Change product design to reduce energy requirements,2.5,Industrial Design,Systems - Misc
2.5196,Use small number of high output units instead of many small inefficient units,2.5,Industrial Design,Systems - Misc
2.6121,Reduce hot water temperature to the minimum required,2.6,Operations,Maintenance
2.6122,Adjust vents to minimize energy use,2.6,Operations,Maintenance
2.6123,Remove unneeded service lines to eliminate potential leaks,2.6,Operations,Maintenance
2.6124,Establish equipment maintenance schedule,2.6,Operations,Maintenance
2.6125,Keep equipment clean,2.6,Operations,Maintenance
2.6126,Keep solid fuels/raw materials dry,2.6,Operations,Maintenance
2.6127,Maintain air filters by cleaning or replacement,2.6,Operations,Maintenance
2.6211,Conserve energy by efficient use of vending machines,2.6,Operations,Equipment Use Reduction
2.6212,"Turn off equipment during breaks, reduce operating time",2.6,Operations,Equipment Use Reduction
2.6213,Turn off steam/hot water lines leading to space heating units,2.6,Operations,Equipment Use Reduction
2.6214,Shut off pilots in standby equipment,2.6,Operations,Equipment Use Reduction
2.6215,Shut off air conditioning in winter heating season,2.6,Operations,Equipment Use Reduction
2.6218,Turn off equipment when not in use,2.6,Operations,Equipment Use Reduction
2.6221,Use most efficient equipment at its maximum capacity,2.6,Operations,Equipment Scheduling
2.6222,Use drying oven (batch type) on alternate days or optimum schedule to run with full loads,2.6,Operations,Equipment Scheduling
2.6223,Schedule use of elevators to conserve energy,2.6,Operations,Equipment Scheduling
2.6224,Schedule baking times of small and large components,2.6,Operations,Equipment Scheduling
2.6225,Eliminate third shift,2.6,Operations,Equipment Scheduling
2.6226,Optimize filtration cleaning/replacement to minimize air resistance,2.6,Operations,Equipment Scheduling
2.6231,Utilize controls to operate equipment only when needed,2.6,Operations,Equipment Automation
2.6232,Install set-back timers,2.6,Operations,Equipment Automation
2.6241,Reduce temperature of process equipment when on standby,2.6,Operations,Load Reduction
2.6242,Minimize operation of equipment maintained in standby condition,2.6,Operations,Load Reduction
2.7111,Reduce illumination to minimum necessary levels,2.7,Building & Grounds,Lighting - Level
2.7121,Utilize daylight whenever possible in lieu of artificial light,2.7,Building & Grounds,Lighting - Operation
2.7122,Disconnect ballasts,2.7,Building & Grounds,Lighting - Operation
2.7123,Keep lamps and reflectors clean,2.7,Building & Grounds,Lighting - Operation
2.7124,Make a practice of turning off lights when not needed,2.7,Building & Grounds,Lighting - Operation
2.7131,Add area lighting switches,2.7,Building & Grounds,Lighting - Controls
2.7132,Install timers on light switches in little used areas,2.7,Building & Grounds,Lighting - Controls
2.7133,Use separate switches on perimeter lighting which may be turned off when natural light is available,2.7,Building & Grounds,Lighting - Controls
2.7134,Use photocell controls,2.7,Building & Grounds,Lighting - Controls
2.7135,Install occupancy sensors,2.7,Building & Grounds,Lighting - Controls
2.7141,Lower light fixtures in high ceiling areas,2.7,Building & Grounds,Lighting - Hardware
2.7142,Utilize higher efficiency lamps and/or ballasts,2.7,Building & Grounds,Lighting - Hardware
2.7144,Install spectral reflectors/delamp,2.7,Building & Grounds,Lighting - Hardware
2.7145,Install skylights,2.7,Building & Grounds,Lighting - Hardware
2.7211,Clean and maintain refrigerant condensers and towers,2.7,Building & Grounds,Space Conditioning - Maintenance
2.7212,Install or upgrade insulation on HVAC distribution systems,2.7,Building & Grounds,Space Conditioning - Maintenance
2.7221,Lower temperature during the winter season and vice-versa,2.7,Building & Grounds,Space Conditioning - Operation
2.7224,Reduce space conditioning during non-working hours,2.7,Building & Grounds,Space Conditioning - Operation
2.7225,Close outdoor air dampers during warm-up/cool-down periods,2.7,Building & Grounds,Space Conditioning - Operation
2.7226,Use computer programs to optimize HVAC performance,2.7,Building & Grounds,Space Conditioning - Operation
2.7227,Use water on air conditioning exchanger,2.7,Building & Grounds,Space Conditioning - Operation
2.7228,"Avoid introducing hot, humid, or dirty air into HVAC system",2.7,Building & Grounds,Space Conditioning - Operation
2.7229,Air condition only space necessary,2.7,Building & Grounds,Space Conditioning - Operation
2.7231,Use radiant heater for spot heating,2.7,Building & Grounds,Space Conditioning - Hardware Heating/Cooling
2.7232,Replace existing HVAC unit with high efficiency model,2.7,Building & Grounds,Space Conditioning - Hardware Heating/Cooling
2.7233,Use properly designed and sized HVAC equipment,2.7,Building & Grounds,Space Conditioning - Hardware Heating/Cooling
2.7234,Use heat pump for space conditioning,2.7,Building & Grounds,Space Conditioning - Hardware Heating/Cooling
