ARC_CODE,DESCRIPTION,ARC_2DIGIT,CATEGORY_NAME,SUBCATEGORY
4.445,Install equipment to move product,4.4,Productivity - Labor,Automation
4.446,Automate finishing process,4.4,Productivity - Labor,Automation
4.447,Automate payroll system,4.4,Productivity - Labor,Automation
4.448,Install automatic part storage/retrieval system,4.4,Productivity - Labor,Automation
4.451,Add additional production shift,4.4,Productivity - Labor,Scheduling
4.452,Eliminate shift,4.4,Productivity - Labor,Scheduling
4.453,Reschedule breaks to allow for continuous production,4.4,Productivity - Labor,Scheduling
4.454,Modify startup/shutdown times,4.4,Productivity - Labor,Scheduling
4.463,Modify facility to avoid excess maintenance costs,4.4,Productivity - Labor,Maintenance
4.511,Expand operations into unused space,4.5,Productivity - Space,Floor Layout
4.512,Condense operation into one building,4.5,Productivity - Space,Floor Layout
4.513,Rearrange equipment layout to reduce labor costs,4.5,Productivity - Space,Floor Layout
4.514,Rearrange equipment layout to reduce handling costs,4.5,Productivity - Space,Floor Layout
4.515,Install shelves/racks to utilize unused space,4.5,Productivity - Space,Floor Layout
4.521,Clear and rent existing space,4.5,Productivity - Space,Rental Space
4.522,Modify storage space to avoid rental of a warehouse,4.5,Productivity - Space,Rental Space
4.611,Begin a practice of predictive/preventative maintenance,4.6,Productivity - Downtime,Maintenance
4.612,Contract out maintenance,4.6,Productivity - Downtime,Maintenance
4.621,Use fixtures to reduce machine changeout times,4.6,Productivity - Downtime,Quick Change
4.622,Install rotating carousels to reduce set-up times,4.6,Productivity - Downtime,Quick Change
4.623,Employ modular jigs to reduce process set-up time,4.6,Productivity - Downtime,Quick Change
4.624,Hire additional personnel to reduce change-out time,4.6,Productivity - Downtime,Quick Change
4.625,Develop standard operating procedures,4.6,Productivity - Downtime,Quick Change
4.631,Install an uninterruptible power supply,4.6,Productivity - Downtime,Power Conditioning
4.632,Change operating conditions,4.6,Productivity - Downtime,Power Conditioning
4.641,Eliminate shutdowns of controls due to overheating,4.6,Productivity - Downtime,Alarms
4.642,Install sensors to detect and avoid jams,4.6,Productivity - Downtime,Alarms
4.651,Install backup equipment,4.6,Productivity - Downtime,Other Equipment
4.652,Replace existing equipment with more suitable substitutes,4.6,Productivity - Downtime,Other Equipment
4.653,Maintain/enlarge a stock of spare parts,4.6,Productivity - Downtime,Other Equipment
4.661,Level Zero - Install control systems for existing equipment,4.6,Productivity - Downtime,Smart Mfg / IIoT
4.662,Level One - Add communication using IIoT devices to existing control system,4.6,Productivity - Downtime,Smart Mfg / IIoT
4.663,Level Two - Install control system using IIoT devices with communication to cloud,4.6,Productivity - Downtime,Smart Mfg / IIoT
4.664,Level Three - Install/modify control system with non-local external information for better decision making,4.6,Productivity - Downtime,Smart Mfg / IIoT
4.711,Initiate a total quality management program,4.7,Productivity - Management,TQM
4.712,Utilize job costing software,4.7,Productivity - Management,TQM
4.721,Initiate a program to acquire ISO certification,4.7,Productivity - Management,Certifications
4.731,Advertise product or service,4.7,Productivity - Management,Marketing
4.811,Demolish old building to reduce tax and insurance bills,4.8,Productivity - Admin,Taxes
4.812,Apply for investment incentives,4.8,Productivity - Admin,Taxes
4.821,Pay bills on time to avoid late fees,4.8,Productivity - Admin,Fees
